"","text","favorited","favoriteCount","replyToSN","created","truncated","replyToSID","id","replyToUID","statusSource","screenName","retweetCount","isRetweet","retweeted","longitude","latitude"
"1","report Missouri Saint Joseph guncontrolnow",FALSE,0,NA,2017-10-23 04:26:20,FALSE,NA,"922318245696360450",NA,"<a href=""http://twibble.io"" rel=""nofollow"">Twibble.io</a>","StruggleNewsBot",0,FALSE,FALSE,NA,NA
"2","we cant continue to debate this issue while people are dying we need action now GunControlNow",FALSE,0,NA,2017-10-23 04:25:45,FALSE,NA,"922318098434330625",NA,"<a href=""http://twitter.com/download/android"" rel=""nofollow"">Twitter for Android</a>","kristalswift",10332,TRUE,FALSE,NA,NA
"3","GunControlNow stopgunviolence",FALSE,0,NA,2017-10-23 04:07:31,FALSE,NA,"922313511962898432",NA,"<a href=""http://twitter.com/download/iphone"" rel=""nofollow"">Twitter for iPhone</a>","magdacoss",0,FALSE,FALSE,NA,NA
"4","Its funny how people will put their effort towards absolutely anything except the obvious GunControlNow",FALSE,0,NA,2017-10-23 04:05:50,FALSE,NA,"922313085951426560",NA,"<a href=""http://twitter.com/download/android"" rel=""nofollow"">Twitter for Android</a>","ecgladstone",0,FALSE,FALSE,NA,NA
"5","Yelling fire in a theater is not protected free speech Threatened violenceassault using a firearm is abuse",FALSE,0,"KHOU",2017-10-23 03:51:45,TRUE,"922307869608988673","922309542121234432","15791186","<a href=""http://twitter.com/download/android"" rel=""nofollow"">Twitter for Android</a>","wilwallace13",0,FALSE,FALSE,NA,NA
"6","I lost track of the time when the outrage died down About days days gunsense needs to trendALWAYS",FALSE,4,NA,2017-10-23 03:49:48,TRUE,NA,"922309053102956544",NA,"<a href=""http://twitter.com/download/android"" rel=""nofollow"">Twitter for Android</a>","acarlson1018",3,FALSE,FALSE,NA,NA
"7","GunControlNow",FALSE,0,"FoxNews",2017-10-23 03:43:29,FALSE,"922302308527906816","922307464485376005","1367531","<a href=""http://twitter.com"" rel=""nofollow"">Twitter Web Client</a>","DebestaIda",0,FALSE,FALSE,NA,NA
"8","new report Kenneth Loftin Jr guncontrolnow",FALSE,0,NA,2017-10-23 03:41:20,FALSE,NA,"922306920291225606",NA,"<a href=""http://twibble.io"" rel=""nofollow"">Twibble.io</a>","StruggleNewsBot",0,FALSE,FALSE,NA,NA
"9","And all talk of reasonable GunControlNow is over until some whacko white guy kills again Sad what this",FALSE,0,"ddiamond",2017-10-23 03:37:29,TRUE,"922295032371130368","922305951117352960","16868756","<a href=""http://twitter.com/download/android"" rel=""nofollow"">Twitter for Android</a>","Zannell1",0,FALSE,FALSE,NA,NA
"10","new report Yousef Alzyoud guncontrolnow",FALSE,0,NA,2017-10-23 03:36:20,FALSE,NA,"922305661878358017",NA,"<a href=""http://twibble.io"" rel=""nofollow"">Twibble.io</a>","StruggleNewsBot",0,FALSE,FALSE,NA,NA
"11","GunControlNow GunControl gunsense GunControlNow EnoughIsEnough GunControlNow gunsense",FALSE,0,"NewtownAction",2017-10-23 03:35:08,TRUE,NA,"922305360454660096","1148468052","<a href=""http://twitter.com"" rel=""nofollow"">Twitter Web Client</a>","2t_isms",0,FALSE,FALSE,NA,NA
"12","GunControlNow the families who suffered losses know every moment without their loves ones is an eternity Why is there no w",FALSE,0,NA,2017-10-23 03:34:24,FALSE,NA,"922305178572791808",NA,"<a href=""http://twitter.com/download/android"" rel=""nofollow"">Twitter for Android</a>","martin_kj",47,TRUE,FALSE,NA,NA
"13","GunControlNow the families who suffered losses know every moment without their loves ones is an eternity Why is there no w",FALSE,0,NA,2017-10-23 03:33:24,FALSE,NA,"922304926033707008",NA,"<a href=""http://twitter.com/download/android"" rel=""nofollow"">Twitter for Android</a>","letahamilton383",47,TRUE,FALSE,NA,NA
"14","This is the sort of pointless stupid argument gun nuts will go to so they ca",FALSE,0,"FoxNews",2017-10-23 03:30:48,TRUE,"922302308527906816","922304271940571136","1367531","<a href=""http://twitter.com"" rel=""nofollow"">Twitter Web Client</a>","RingoZobel",0,FALSE,FALSE,NA,NA
"15","GunControlNow the families who suffered losses know every moment without their loves ones is an eternity Why is there no w",FALSE,0,NA,2017-10-23 03:22:30,FALSE,NA,"922302182602416128",NA,"<a href=""http://twitter.com/download/iphone"" rel=""nofollow"">Twitter for iPhone</a>","iproofer1",47,TRUE,FALSE,NA,NA
"16","report Paul Collins guncontrolnow",FALSE,0,NA,2017-10-23 03:21:39,FALSE,NA,"922301970613927936",NA,"<a href=""http://twibble.io"" rel=""nofollow"">Twibble.io</a>","StruggleNewsBot",0,FALSE,FALSE,NA,NA
"17","report guncontrolnow",FALSE,0,NA,2017-10-23 03:16:19,FALSE,NA,"922300628310876163",NA,"<a href=""http://twibble.io"" rel=""nofollow"">Twibble.io</a>","StruggleNewsBot",0,FALSE,FALSE,NA,NA
"18","a GunControlNow shutup gunowner",FALSE,0,NA,2017-10-23 03:14:53,FALSE,NA,"922300267038683136",NA,"<a href=""http://twitter.com/download/iphone"" rel=""nofollow"">Twitter for iPhone</a>","WIRightSconnie",0,FALSE,FALSE,NA,NA
"19","I lt Bill and Diane Durston This couple is determined to do all they can to stop gun violence",FALSE,0,NA,2017-10-23 03:08:16,TRUE,NA,"922298600473763841",NA,"<a href=""http://twitter.com/download/android"" rel=""nofollow"">Twitter for Android</a>","AlexReagan123",0,FALSE,FALSE,NA,NA
"20","StoptheWarOnWomen EnoughIsEnough ImpeachAndImprisonPenceAnd OustGOP PuertoRicoRelief GunControlNow",FALSE,0,NA,2017-10-23 03:06:44,TRUE,NA,"922298216552464384",NA,"<a href=""http://twitter.com"" rel=""nofollow"">Twitter Web Client</a>","2t_isms",0,FALSE,FALSE,NA,NA
"21","I got my copy signed GunControlNow StopGunViolence",FALSE,1,NA,2017-10-23 02:59:35,FALSE,NA,"922296416046694400",NA,"<a href=""http://twitter.com/download/android"" rel=""nofollow"">Twitter for Android</a>","AlexReagan123",0,FALSE,FALSE,NA,NA
"22","Ah this makes much more sense now Thanks Youre a terrorist group you know that right GunControlNow",FALSE,0,NA,2017-10-23 02:59:13,FALSE,NA,"922296321540804614",NA,"<a href=""http://twitter.com/download/iphone"" rel=""nofollow"">Twitter for iPhone</a>","KatieDeroche",0,FALSE,FALSE,NA,NA
"23","And nothing has changed that would prevent this exact scenario from repeating GunControlNow",FALSE,0,NA,2017-10-23 02:57:03,FALSE,NA,"922295777027801089",NA,"<a href=""http://twitter.com/download/iphone"" rel=""nofollow"">Twitter for iPhone</a>","MuyLinda206",0,FALSE,FALSE,NA,NA
"24","Go check out my newest single drop di gun GunControlNow guncrime brent northwest ghettolife",FALSE,0,NA,2017-10-23 02:52:30,FALSE,NA,"922294632167428096",NA,"<a href=""http://twitter.com/download/android"" rel=""nofollow"">Twitter for Android</a>","Santana_x_",0,FALSE,FALSE,NA,NA
"25","Joshua Sugarmann founder and director of and an author speaks to a full house at our first annual dinner",FALSE,2,NA,2017-10-23 02:44:59,TRUE,NA,"922292742830440448",NA,"<a href=""http://twitter.com/download/android"" rel=""nofollow"">Twitter for Android</a>","StopGunV",1,FALSE,FALSE,NA,NA
"26","Almost time to hear the keynote address by Josh Sugarmann of on Gun Violence in America A Preventable Epi",FALSE,2,NA,2017-10-23 02:34:54,TRUE,NA,"922290202835542016",NA,"<a href=""http://twitter.com/download/android"" rel=""nofollow"">Twitter for Android</a>","StopGunV",0,FALSE,FALSE,NA,NA
"27","I knowthanks for reminding me I m in the USA and I m not sure locks are enough USA security GunControlNow",FALSE,0,NA,2017-10-23 02:32:13,FALSE,NA,"922289526306779141",NA,"<a href=""http://twitter.com/download/iphone"" rel=""nofollow"">Twitter for iPhone</a>","RealLuckyPhil",0,FALSE,FALSE,NA,NA
"28","Dad was a PO Alwys reminded NEVER touch his gunHe was stunned sibs ampI told him yrs later w",FALSE,0,"ursusmiratus",2017-10-23 02:29:25,TRUE,"922111158554947585","922288821508739077","710375905873494016","<a href=""http://twitter.com/download/iphone"" rel=""nofollow"">Twitter for iPhone</a>","acosta7373",0,FALSE,FALSE,NA,NA
"29","Everyone should demand Kelly apologizehe lied And GunControlNow",FALSE,0,NA,2017-10-23 02:26:20,FALSE,NA,"922288047906947072",NA,"<a href=""http://twitter.com/download/iphone"" rel=""nofollow"">Twitter for iPhone</a>","carol_weinfeld",0,FALSE,FALSE,NA,NA
"30","Deplorable and GunControlNow",FALSE,0,NA,2017-10-23 02:23:05,FALSE,NA,"922287227677245440",NA,"<a href=""http://twitter.com/download/iphone"" rel=""nofollow"">Twitter for iPhone</a>","carol_weinfeld",0,FALSE,FALSE,NA,NA
"31","He seems uncomfortable thats what I want to hear about a guy holding a rifle ThisIsLife GunControlNow RepealThendAmendment",FALSE,4,"TheH0MIE",2017-10-23 02:18:48,FALSE,"922285198502453248","922286151813206016","290588490","<a href=""http://twitter.com/download/android"" rel=""nofollow"">Twitter for Android</a>","TheH0MIE",0,FALSE,FALSE,NA,NA
"32","The fact that they are hiding their faces should tell you all you need to know ThisIsLife RepealThendAmendment GunControlNow",FALSE,2,"TheH0MIE",2017-10-23 02:15:01,FALSE,"922282832541769728","922285198502453248","290588490","<a href=""http://twitter.com/download/android"" rel=""nofollow"">Twitter for Android</a>","TheH0MIE",0,FALSE,FALSE,NA,NA
"33","new report guncontrolnow",FALSE,0,NA,2017-10-23 02:11:19,FALSE,NA,"922284267434061824",NA,"<a href=""http://twibble.io"" rel=""nofollow"">Twibble.io</a>","StruggleNewsBot",0,FALSE,FALSE,NA,NA
"34","report guncontrolnow",FALSE,0,NA,2017-10-23 02:06:39,FALSE,NA,"922283092949307392",NA,"<a href=""http://twibble.io"" rel=""nofollow"">Twibble.io</a>","StruggleNewsBot",0,FALSE,FALSE,NA,NA
"35","GunControlNow Gave his life protecting others You have his blood on your hands",FALSE,0,NA,2017-10-23 02:01:05,FALSE,NA,"922281695201636353",NA,"<a href=""http://twitter.com"" rel=""nofollow"">Twitter Web Client</a>","adivawoman",0,FALSE,FALSE,NA,NA
"36","GunControlNow WhatWillItTake Here we go again",FALSE,0,NA,2017-10-23 01:59:42,FALSE,NA,"922281346109669377",NA,"<a href=""http://twitter.com/download/android"" rel=""nofollow"">Twitter for Android</a>","Tim_Chauncey",0,FALSE,FALSE,NA,NA
"37","Merica Where the goes after Cub Scouts who question their public policies shameful",FALSE,0,"thehill",2017-10-23 01:51:53,TRUE,"922273635607416832","922279378360438784","1917731","<a href=""http://twitter.com/download/android"" rel=""nofollow"">Twitter for Android</a>","melina5299",0,FALSE,FALSE,NA,NA
"38","Indivisible RejectTheNRA GunControlNow LasVegasShooting HR              YOU CAN CALL NO MATTER WHERE YOU LIVE This is a",FALSE,0,NA,2017-10-23 01:37:34,FALSE,NA,"922275776233226240",NA,"<a href=""http://twitter.com"" rel=""nofollow"">Twitter Web Client</a>","SallyDeal4",61,TRUE,FALSE,NA,NA
"39","We just witnessed the most ruthless gun attack on a group of people in the US Las Vegas Before that Orlan",FALSE,0,"NRATV",2017-10-23 01:37:20,TRUE,NA,"922275718276493313","17564591","<a href=""http://twitter.com/download/android"" rel=""nofollow"">Twitter for Android</a>","skeptickin",0,FALSE,FALSE,NA,NA
"40","Yes Because the answer to violence is to give people more guns Makes perfect sense OMGGunControlNow",FALSE,0,"ursusmiratus",2017-10-23 01:33:31,FALSE,"922111158554947585","922274756640018432","710375905873494016","<a href=""http://twitter.com/download/android"" rel=""nofollow"">Twitter for Android</a>","jamie5577jamie",0,FALSE,FALSE,NA,NA
"41","TEXAS RIGHT TO KEEP AND BEAR ARMS GunControlNow GunControl Gunsense NRA Guns",FALSE,2,NA,2017-10-23 01:32:32,FALSE,NA,"922274506596585472",NA,"<a href=""http://twitter.com"" rel=""nofollow"">Twitter Web Client</a>","dilly_bob",0,FALSE,FALSE,NA,NA
"42","GunControlNow saveourchildren",FALSE,0,NA,2017-10-23 01:22:28,FALSE,NA,"922271973673259009",NA,"<a href=""http://twitter.com"" rel=""nofollow"">Twitter Web Client</a>","stevensmom523",49,TRUE,FALSE,NA,NA
"43","a not GunControlNow",FALSE,0,"wikileaks",2017-10-23 01:15:52,FALSE,"922257331940978688","922270314217852928","16589206","<a href=""https://mobile.twitter.com"" rel=""nofollow"">Twitter Lite</a>","lebanon_tn",0,FALSE,FALSE,NA,NA
"44","Ames Mayfield should be celebrated not ostracized by Shameful GunControlNow",FALSE,0,NA,2017-10-23 01:06:32,FALSE,NA,"922267963494928384",NA,"<a href=""http://twitter.com/download/android"" rel=""nofollow"">Twitter for Android</a>","jasoneckardt",0,FALSE,FALSE,NA,NA
"45","GunControlNow VegasStrong LasVegasMassacre NRAKills StopGunViolence RepealThend",FALSE,0,NA,2017-10-23 01:05:30,TRUE,NA,"922267704056090624",NA,"<a href=""http://twitter.com"" rel=""nofollow"">Twitter Web Client</a>","TeriMcGill",0,FALSE,FALSE,NA,NA
"46","GunControlNow guncontrol LasVegasShooting PrayForVegas harshtruth",FALSE,0,NA,2017-10-23 01:01:57,FALSE,NA,"922266813894766592",NA,"<a href=""http://twitter.com"" rel=""nofollow"">Twitter Web Client</a>","Daviddannystryk",1,TRUE,FALSE,NA,NA
"47","GunControlNow saveourchildren",FALSE,0,NA,2017-10-23 01:01:00,FALSE,NA,"922266573276147714",NA,"<a href=""http://twitter.com/#!/download/ipad"" rel=""nofollow"">Twitter for iPad</a>","Unity_Coach",49,TRUE,FALSE,NA,NA
"48","Complicit StopGunViolence GunControlNow ImpeachTrump TrumpRussia TrumpIsAMoron",FALSE,0,NA,2017-10-23 00:55:34,FALSE,NA,"922265204343259136",NA,"<a href=""http://twitter.com/download/android"" rel=""nofollow"">Twitter for Android</a>","tedrobak",2,TRUE,FALSE,NA,NA
"49","GunControlNow saveourchildren",FALSE,0,NA,2017-10-23 00:46:59,FALSE,NA,"922263046772416513",NA,"<a href=""http://twitter.com"" rel=""nofollow"">Twitter Web Client</a>","Glambert40291",49,TRUE,FALSE,NA,NA
"50","thenfixguncontrolyoudafttwerp ITMFA GunControlNow Hypocrite",FALSE,0,"realDonaldTrump",2017-10-23 00:39:32,FALSE,NA,"922261169225822208","25073877","<a href=""http://twitter.com"" rel=""nofollow"">Twitter Web Client</a>","gardengirlove",0,FALSE,FALSE,NA,NA
"51","Support GunControlNow",FALSE,0,"isaiahlevi9_",2017-10-23 00:39:10,FALSE,"921846071504130048","922261079807418369","890062327512301568","<a href=""http://twitter.com"" rel=""nofollow"">Twitter Web Client</a>","Jahmikel_Jordan",0,FALSE,FALSE,NA,NA
"52","GunControlNow saveourchildren",FALSE,0,NA,2017-10-23 00:37:47,FALSE,NA,"922260731302735873",NA,"<a href=""http://twitter.com/download/android"" rel=""nofollow"">Twitter for Android</a>","Ernierouge",49,TRUE,FALSE,NA,NA
"53","report Marcus Carter guncontrolnow",FALSE,0,NA,2017-10-23 00:36:37,FALSE,NA,"922260436883472384",NA,"<a href=""http://twibble.io"" rel=""nofollow"">Twibble.io</a>","StruggleNewsBot",0,FALSE,FALSE,NA,NA
"54","LasVegasShooting PulseNightClub VirginaTech SandyHook GunControlNow gunsense GUNviolence GunLaws StopTheViolence Sto",FALSE,0,NA,2017-10-23 00:35:49,FALSE,NA,"922260235158523904",NA,"<a href=""http://twitter.com/download/android"" rel=""nofollow"">Twitter for Android</a>","cyndiweston",19,TRUE,FALSE,NA,NA
"55","This boy raised a very good point It makes sense It doesnt make sense for adults to retaliate against him",FALSE,0,NA,2017-10-23 00:34:52,TRUE,NA,"922259995076497409",NA,"<a href=""http://twitter.com/download/iphone"" rel=""nofollow"">Twitter for iPhone</a>","me15226986",0,FALSE,FALSE,NA,NA
"56","report Lucas Stark guncontrolnow",FALSE,0,NA,2017-10-23 00:31:17,FALSE,NA,"922259094576263168",NA,"<a href=""http://twibble.io"" rel=""nofollow"">Twibble.io</a>","StruggleNewsBot",0,FALSE,FALSE,NA,NA
"57","Aren t you sick of hearing the worst shooting in American history Aren t you ARENT YOU ActiveShooter GunControlNow",FALSE,2,NA,2017-10-23 00:23:11,FALSE,NA,"922257057025331200",NA,"<a href=""http://twitter.com/#!/download/ipad"" rel=""nofollow"">Twitter for iPad</a>","CathyofTO",1,FALSE,FALSE,NA,NA
"58","GunControlNow the families who suffered losses know every moment without their loves ones is an eternity Why is there no w",FALSE,0,NA,2017-10-23 00:22:51,FALSE,NA,"922256973784944640",NA,"<a href=""http://twitter.com/download/android"" rel=""nofollow"">Twitter for Android</a>","chestnut_daniel",47,TRUE,FALSE,NA,NA
"59","the more guns a society has the less crime or murders are committed  What a distorted dumb logic Vick",FALSE,0,"nytimes",2017-10-23 00:19:43,TRUE,"922149328587771904","922256184702365696","807095","<a href=""http://twitter.com"" rel=""nofollow"">Twitter Web Client</a>","RosalyBr",0,FALSE,FALSE,NA,NA
"60","GunControlNow the families who suffered losses know every moment without their loves ones is an eternity Why is there no w",FALSE,0,NA,2017-10-23 00:11:49,FALSE,NA,"922254197369778177",NA,"<a href=""http://twitter.com/download/iphone"" rel=""nofollow"">Twitter for iPhone</a>","MosesDidItBest",47,TRUE,FALSE,NA,NA
"61","Then she would rightfully be in prisonand this is a prime example of why we need GunControlNow",FALSE,0,"thehill",2017-10-23 00:07:03,FALSE,"922230357755351041","922252995357638656","1917731","<a href=""http://twitter.com/download/iphone"" rel=""nofollow"">Twitter for iPhone</a>","Dingodog",0,FALSE,FALSE,NA,NA
"62","Holy bejesus This is some nasty stuff Are we really living in the st century GunControlNow propaganda",FALSE,0,NA,2017-10-23 00:05:59,FALSE,NA,"922252726490185728",NA,"<a href=""http://twitter.com/download/iphone"" rel=""nofollow"">Twitter for iPhone</a>","oiramotel",0,FALSE,FALSE,NA,NA
"63","GunControlNow saveourchildren",FALSE,0,NA,2017-10-23 00:04:00,FALSE,NA,"922252228437659649",NA,"<a href=""http://twitter.com/download/iphone"" rel=""nofollow"">Twitter for iPhone</a>","foureyes60",49,TRUE,FALSE,NA,NA
"64","RapeCulture GunControlNow",FALSE,0,NA,2017-10-22 23:56:09,FALSE,NA,"922250253780299776",NA,"<a href=""http://twitter.com/download/android"" rel=""nofollow"">Twitter for Android</a>","SupremCourtJest",0,FALSE,FALSE,NA,NA
"65","LasVegasShooting PulseNightClub VirginaTech SandyHook GunControlNow gunsense GUNviolence GunLaws StopTheViolence Sto",FALSE,0,NA,2017-10-22 23:55:21,FALSE,NA,"922250052382396422",NA,"<a href=""http://twitter.com/download/iphone"" rel=""nofollow"">Twitter for iPhone</a>","fvicente5690",19,TRUE,FALSE,NA,NA
"66","GunControlNow the families who suffered losses know every moment without their loves ones is an eternity Why is there no w",FALSE,0,NA,2017-10-22 23:52:52,FALSE,NA,"922249426479075328",NA,"<a href=""http://twitter.com/#!/download/ipad"" rel=""nofollow"">Twitter for iPad</a>","BudGothmog44",47,TRUE,FALSE,NA,NA
"67","GunControlNow saveourchildren",FALSE,0,NA,2017-10-22 23:52:02,FALSE,NA,"922249214884831232",NA,"<a href=""http://twitter.com/download/iphone"" rel=""nofollow"">Twitter for iPhone</a>","llwood9663",49,TRUE,FALSE,NA,NA
"68","Resistance NotMyPresident Resist Trump Dotard GunControlNow NFL NRA RussiaGate Putinspuppet Racist homophobic Imp",FALSE,0,NA,2017-10-22 23:50:15,FALSE,NA,"922248769273499648",NA,"<a href=""http://twitter.com/download/android"" rel=""nofollow"">Twitter for Android</a>","Dax_x98",14,TRUE,FALSE,NA,NA
"69","LasVegasShooting PulseNightClub VirginaTech SandyHook GunControlNow gunsense GUNviolence GunLaws StopTheViolence Sto",FALSE,0,NA,2017-10-22 23:50:06,FALSE,NA,"922248731658989570",NA,"<a href=""http://twitter.com/download/android"" rel=""nofollow"">Twitter for Android</a>","Dax_x98",19,TRUE,FALSE,NA,NA
"70","GunControlNow the families who suffered losses know every moment without their loves ones is an eternity Why is there no w",FALSE,0,NA,2017-10-22 23:47:13,FALSE,NA,"922248004303716353",NA,"<a href=""http://twitter.com/download/iphone"" rel=""nofollow"">Twitter for iPhone</a>","volkhaven",47,TRUE,FALSE,NA,NA
"71","GunControlNow the families who suffered losses know every moment without their loves ones is an eternity Why is there no w",FALSE,0,NA,2017-10-22 23:41:56,FALSE,NA,"922246676001296384",NA,"<a href=""http://twitter.com/download/android"" rel=""nofollow"">Twitter for Android</a>","tinyboo49",47,TRUE,FALSE,NA,NA
"72","GunControlNow the families who suffered losses know every moment without their loves ones is an eternity Why is there no w",FALSE,0,NA,2017-10-22 23:39:34,FALSE,NA,"922246080342794240",NA,"<a href=""http://twitter.com/download/android"" rel=""nofollow"">Twitter for Android</a>","nursingartist",47,TRUE,FALSE,NA,NA
"73","new report Chadrick Spurlock guncontrolnow",FALSE,0,NA,2017-10-22 23:36:37,FALSE,NA,"922245336185393152",NA,"<a href=""http://twibble.io"" rel=""nofollow"">Twibble.io</a>","StruggleNewsBot",0,FALSE,FALSE,NA,NA
"74","GunControlNow",FALSE,0,NA,2017-10-22 23:32:04,FALSE,NA,"922244190045638662",NA,"<a href=""http://twitter.com"" rel=""nofollow"">Twitter Web Client</a>","durham_lou",0,FALSE,FALSE,NA,NA
"75","GunControlNow the families who suffered losses know every moment without their loves ones is an eternity Why is there no w",FALSE,0,NA,2017-10-22 23:28:11,FALSE,NA,"922243213498486784",NA,"<a href=""http://twitter.com/download/iphone"" rel=""nofollow"">Twitter for iPhone</a>","byebye45byebye",47,TRUE,FALSE,NA,NA
"76","October Multiple mass shootings incl deadliest in recent history Nazis shooting into crowds AGAIN",FALSE,0,NA,2017-10-22 23:28:00,TRUE,NA,"922243166761308160",NA,"<a href=""https://mobile.twitter.com"" rel=""nofollow"">Twitter Lite</a>","JonLibbyTwit",0,FALSE,FALSE,NA,NA
"77","GunControlNow saveourchildren",FALSE,0,NA,2017-10-22 23:26:22,FALSE,NA,"922242755744665600",NA,"<a href=""http://twitter.com/download/iphone"" rel=""nofollow"">Twitter for iPhone</a>","kdw_8437",49,TRUE,FALSE,NA,NA
"78","GunControlNow saveourchildren",FALSE,0,NA,2017-10-22 23:25:43,FALSE,NA,"922242594318544896",NA,"<a href=""http://twitter.com/download/iphone"" rel=""nofollow"">Twitter for iPhone</a>","philipdavison",49,TRUE,FALSE,NA,NA
"79","If our lax gun laws applied only to black males amp all women I would be in favor of them gunsense nra GunControlNow",FALSE,0,NA,2017-10-22 23:24:10,FALSE,NA,"922242204919312385",NA,"<a href=""http://twitter.com/#!/download/ipad"" rel=""nofollow"">Twitter for iPad</a>","cfmman",0,FALSE,FALSE,NA,NA
"80","GunControlNow the families who suffered losses know every moment without their loves ones is an eternity Why is there no w",FALSE,0,NA,2017-10-22 23:21:11,FALSE,NA,"922241454784827392",NA,"<a href=""http://twitter.com/download/android"" rel=""nofollow"">Twitter for Android</a>","LaynieDane",47,TRUE,FALSE,NA,NA
"81","GunControlNow the families who suffered losses know every moment without their loves ones is an eternity Why is there no w",FALSE,0,NA,2017-10-22 23:19:17,FALSE,NA,"922240974570471424",NA,"<a href=""http://twitter.com/#!/download/ipad"" rel=""nofollow"">Twitter for iPad</a>","borealizz",47,TRUE,FALSE,NA,NA
"82","GunControlNow the families who suffered losses know every moment without their loves ones is an eternity Why is there no w",FALSE,0,NA,2017-10-22 23:18:25,FALSE,NA,"922240757796241408",NA,"<a href=""http://twitter.com/download/iphone"" rel=""nofollow"">Twitter for iPhone</a>","Socratic1",47,TRUE,FALSE,NA,NA
"83","GunControlNow the families who suffered losses know every moment without their loves ones is an eternity Why is there no w",FALSE,0,NA,2017-10-22 23:16:37,FALSE,NA,"922240305503535106",NA,"<a href=""http://itunes.apple.com/us/app/twitter/id409789998?mt=12"" rel=""nofollow"">Twitter for Mac</a>","Al_Czarnecki",47,TRUE,FALSE,NA,NA
"84","GunControlNow the families who suffered losses know every moment without their loves ones is an eternity Why is there no w",FALSE,0,NA,2017-10-22 23:16:15,FALSE,NA,"922240211450519552",NA,"<a href=""http://www.twitter.com"" rel=""nofollow"">Twitter for Windows Phone</a>","occtoys",47,TRUE,FALSE,NA,NA
"85","GunControlNow the families who suffered losses know every moment without their loves ones is an eternity Why is there no w",FALSE,0,NA,2017-10-22 23:15:46,FALSE,NA,"922240091040436229",NA,"<a href=""http://twitter.com"" rel=""nofollow"">Twitter Web Client</a>","PersephoneChild",47,TRUE,FALSE,NA,NA
"86","GunControlNow the families who suffered losses know every moment without their loves ones is an eternity Why is there no w",FALSE,0,NA,2017-10-22 23:14:57,FALSE,NA,"922239886446485504",NA,"<a href=""http://twitter.com/download/iphone"" rel=""nofollow"">Twitter for iPhone</a>","LibbyBlog",47,TRUE,FALSE,NA,NA
"87","GunControlNow the families who suffered losses know every moment without their loves ones is an eternity Why is there no w",FALSE,0,NA,2017-10-22 23:13:44,FALSE,NA,"922239579184345089",NA,"<a href=""https://mobile.twitter.com"" rel=""nofollow"">Twitter Lite</a>","leftoverleftist",47,TRUE,FALSE,NA,NA
"88","GunControlNow the families who suffered losses know every moment without their loves ones is an eternity Why is there no w",FALSE,0,NA,2017-10-22 23:13:07,FALSE,NA,"922239421059014656",NA,"<a href=""http://twitter.com/download/iphone"" rel=""nofollow"">Twitter for iPhone</a>","BeSeriousUSA",47,TRUE,FALSE,NA,NA
"89","GunControlNow saveourchildren",FALSE,0,NA,2017-10-22 23:11:10,FALSE,NA,"922238931164450816",NA,"<a href=""http://twitter.com/download/iphone"" rel=""nofollow"">Twitter for iPhone</a>","rita_deen",49,TRUE,FALSE,NA,NA
"90","more people die each day f guns than f opioids Why is one worth addressing but the other not GunControlNow howmanymore",FALSE,2,"senrobportman",2017-10-22 22:59:14,FALSE,NA,"922235929858859013","18915145","<a href=""http://twitter.com/download/android"" rel=""nofollow"">Twitter for Android</a>","politicabs",1,FALSE,FALSE,NA,NA
"91","LiberalLogic LiberalismIsAMentalDisorder GunSense GunControl GunControlNow Liberal liberals A ndAmendment gu",FALSE,0,NA,2017-10-22 22:53:41,FALSE,NA,"922234532291424256",NA,"<a href=""http://twitter.com"" rel=""nofollow"">Twitter Web Client</a>","D_Walker1773",4,TRUE,FALSE,NA,NA
"92","GunControlNow saveourchildren",FALSE,0,NA,2017-10-22 22:51:49,FALSE,NA,"922234062693126146",NA,"<a href=""http://twitter.com/download/android"" rel=""nofollow"">Twitter for Android</a>","Sepulcher67",49,TRUE,FALSE,NA,NA
"93","So much tragedy",FALSE,1,"resistasista76",2017-10-22 22:49:20,TRUE,"922231579459469312","922233436621942786","860893410277728256","<a href=""http://twitter.com/download/android"" rel=""nofollow"">Twitter for Android</a>","susanmddem",0,FALSE,FALSE,NA,NA
